topic,meeting_id,title,call_type,speaker_name,time_sec,snippet,score
Compliance & Audit Readiness,01KQ5AFAE8264DDC0ED2AE7F,Aegis / Crestline Wealth - Identity Module Deployment,external,Sofia Petrov,222.9,"Yeah, definitely. So, at a high level we're looking at three phases for a deployment like yours. Phase one is directory sync and SSO configuration — basically getting Aegis Identity talking to your Entra ID environment, setting up the SAML or OIDC connectors, depending on what your apps support. Phase two is MFA policy configuration and enrollment, which is where we'd handle that phased migration you mentioned. And then phase three is privileged access management, which sounds like it's actually going to be really important for you given what the auditors flagged.",60.7
Compliance & Audit Readiness,01KQ1267C6AA7D9B3125FEC8,SOC 2 Audit Preparation - Internal,internal,Raj Kapoor,479.3,"Good. Okay, let me just summarize what we've got so far in terms of action items. Ravi, you're doing the log retention inventory by Wednesday and the CI/CD gate for production deployments before March first. Mike, you're looking at the Zendesk PagerDuty integration and taking a pass at the vendor compliance documentation. Tyler, you're following up with legal on BAAs and keeping the access review records organized. Brian, you're participating in the alert tuning session. Does that all sound right?",57.5
Compliance & Audit Readiness,01KQ5AFAE8264DDC0ED2AE7F,Aegis / Crestline Wealth - Identity Module Deployment,external,Sofia Petrov,269.0,"So it's quite a bit more than just session recording, which I think you'll find pretty compelling. Aegis Identity gives you just-in-time access provisioning for admin roles, so instead of users having standing admin privileges 24/7, they request elevated access for a specific window, it gets approved through a workflow, and then it auto-expires. You still get full session recording and audit logs, but the just-in-time piece is really what closes that standing privilege gap that auditors love to flag.",57.25
"Identity, Access & Provisioning",01KQ4D504CE09A8F6ECA1F5A,Product Sync - Identity Roadmap,internal,Ananya Sharma,193.5,"Yeah, so the design did shift a bit. The original plan was to build a rules-based engine where admins could define MFA requirements per user group and per application. That's still the core of it. What changed is we're now also looking at adding a risk-signal layer, so the system can factor in things like login location, device fingerprint, time of day — and then either require step-up auth or flag it for review.",54.2
"Identity, Access & Provisioning",01KQ764171AC27A3A94DC695,Detect Reliability - 30-Day Review,internal,Tyler Washington,167.2,"So we shipped two things. First was redundant processing nodes — we now have three ingestion nodes running in parallel with automatic failover. If one goes down, the other two absorb the load. Second thing was implementing the circuit breaker pattern, which basically means if we detect that a downstream component is failing, the system stops trying to push work to it and routes around it instead of just hammering it until everything collapses.",53.2
"Identity, Access & Provisioning",01KQCA6EA8B603EBB6C9FE34,Aegis / Ridgeline Logistics - Identity Roadmap Discussion,external,Paula Schneider,120.6,"It's kind of both. So the session timeout is set globally right now, and we can't scope it by device group or location. So a desk employee in corporate gets the same timeout window as a warehouse terminal, which doesn't make sense. And then when worker A logs out and worker B logs in, sometimes the previous session data is still cached and that creates... it creates issues. We've had a couple of incidents where someone had residual access they shouldn't have had.",51.65
Incident Response & Outage Management,01KQ298F2846EFE59B0D70E2,Competitive Threat Assessment - Post Outage,ambiguous,Brian Cho,183.5,"So we had — ugh — we had a spike of about 340 tickets come in during and immediately after the outage. We've closed most of them, but there are still about 40 open, mostly from customers who want detailed impact reports, like specifically which alerts they missed during the window, what events weren't processed. And a handful of those customers are, uh, pretty heated. I had one escalation yesterday where the customer's security team is claiming they had an actual incident during the outage window and they're saying our lack of visibility may have delayed their response.",60.0
Incident Response & Outage Management,01KQ45C76AF3AEA6B3EA6697,Aegis / Steelpoint Manufacturing - Contract Review,external,Sofia Petrov,140.3,"Sure. So the root cause was a single point of failure in our event ingestion pipeline — basically the primary processing node went down and there was no automatic failover in place at that layer. The cascading effect hit the whole detection feed. Since then we've deployed redundant processing nodes and implemented a circuit breaker pattern so that if one component fails, it isolates rather than cascades. We've been running that in production for about a week now and it's been stable.",55.5
Incident Response & Outage Management,01KQ2217B066855A3B7814CB,Aegis / Meridian Capital - Service Reliability Discussion,external,Rachel Torres,510.7,"Okay, let me summarize and you can tell me if I'm missing anything. Ravi's going to send over the infrastructure audit summary by Monday. We're committing to end-of-month production deployment of the circuit breaker fix and redundant nodes. And I'd like to schedule a follow-up call in two weeks — not to sell you anything, just to check in and make sure the interim monitoring is holding and answer any questions that come up from your internal review.",51.9
Platform Reliability & Performance,01KQD1270E98A7DFC55ADCF8,Protect Performance - Scalability Concerns,ambiguous,Sofia Petrov,240.8,"Honestly? It's not a quick fix. The scheduler wasn't designed to be horizontally scalable. To do this properly we'd probably need to refactor the dispatch layer, introduce some kind of distributed queue — I keep thinking something like a partitioned queue model would actually solve this — but we're talking weeks of work. Plural. Not two weeks, more like... six to eight minimum if we want to do it right and not create new problems.",51.35
Platform Reliability & Performance,01KQA0F0BE68E74D66EB4171,Competitive Response Strategy,ambiguous,Jordan Whitfield,248.2,"Yeah, so — Comply v2 is actually a pretty strong differentiator right now because SentinelShield and VaultEdge both have compliance features but they're more of a bolt-on. Like you can tell they didn't design around compliance workflows from the ground up. What we launched on April 7th — the on-demand reporting for SOC 2, PCI DSS, HIPAA, ISO 27001 — that's all native, it's integrated directly with the detection and identity layers.",47.3
Platform Reliability & Performance,01KQD1270E98A7DFC55ADCF8,Protect Performance - Scalability Concerns,ambiguous,Sofia Petrov,178.3,"So I've been doing some digging since Tyler shared the numbers yesterday, and I think there are actually two separate issues tangled together here. One is the scheduler concurrency problem which Nina flagged, and the other is — and this one I actually didn't expect — the snapshot deduplication layer is doing a lot of synchronous I/O that it really shouldn't be. Like it's blocking on disk reads mid-job.",45.3
Product Roadmap & Engineering Execution,01KQ0CAE7F064EC93F0540CA,Weekly Engineering Standup,internal,Tom Bradley,112.4,"Yeah, a couple things. One — I had a conversation with product Friday and they're asking again about the timeline for the Detect reliability work. They want to know if we're still comfortable with end of March. And two — the Comply v2 launch is tracking for early April, so I want to make sure we haven't over-allocated anyone against Detect to where we can't support any last-minute Comply stuff.",45.3
Product Roadmap & Engineering Execution,01KQ77F2867FC54E13A8C495,Aegis / Brightpath Commerce - Detect Module Deployment,external,James Mitchell,225.4,"Ha, I love that type. That makes the process a lot smoother honestly. Okay so — on the Detect side specifically, I want to make sure we talk about alerting configuration because that's usually where onboarding takes the most time. You can get the data flowing pretty quickly, but tuning the alerts so you're not buried in noise — that's the art of it.",43.7
Product Roadmap & Engineering Execution,01KQ77F2867FC54E13A8C495,Aegis / Brightpath Commerce - Detect Module Deployment,external,James Mitchell,261.1,"Totally understandable, and that's a really common scenario especially in retail where you've got... a lot of legitimate high-volume traffic patterns that can look suspicious if you don't tune for them. Aegis Detect has baseline learning built in — it runs in observation mode for the first seven days and builds a behavioral baseline before it starts generating production alerts.",42.7
"Renewal, Pricing & Commercial Negotiation",01KQA502E222E2A60330237B,Aegis / Pineridge Systems - Q1 Business Review,external,Daniel Okafor,541.2,"That's exactly what we're going for. We really value the partnership with Pineridge and we want these conversations to feel like they're worth your time. Alright — let me just recap the action items real quick: Ananya is going to put together the tiered restore playbook, I'm going to send over the ROI template for Comply v2, get you on the early access list, and we'll schedule a commercial follow-up for mid-April. Sound right?",48.6
"Renewal, Pricing & Commercial Negotiation",01KQADF3D76E82BF8BA19AF2,All Hands - February Wrap,internal,Nina Kowalski,283.1,"Nothing that rises to the level of a flag, really. Regression suite has been stable. The one thing I'd say is we've had a few intermittent test failures on the event processing tests specifically — like, they pass on rerun, which makes them hard to track down. Could be related to what Megan's describing, could be test environment flakiness, we're not sure yet.",44.0
"Renewal, Pricing & Commercial Negotiation",01KQD4D9DEBA2D55AC2AA9F5,Aegis / Keystone Health - Renewal Planning,external,Rachel Torres,170.1,"Yeah so we're doing a major launch of Aegis Comply version two next month — we're looking at early April — and the headline feature is on-demand compliance reporting across multiple frameworks simultaneously, so HIPAA obviously but also SOC 2, PCI DSS, ISO 27001, all in one place, no more running separate report cycles.",43.7
Security Monitoring & Threat Detection,01KQ41FB5CCFD9EA583FB020,Aegis / Harborview Banking - Threat Detection Tuning,external,Kevin O'Brien,940.4,"Sure. So I'll send a session summary with all the changes made today — which is just the privileged access monitoring ruleset flip — and all the pending action items. I'll include the storage estimate for the twelve-month retention setting, the template for the bulk high-mobility user update, and step-by-step instructions for the PagerDuty integration. For the trusted location profiles and work schedule profiles, we should probably schedule a follow-up working session to get those configured properly — I'd want your Manila IT contact on that call if possible.",59.25
Security Monitoring & Threat Detection,01KQ41FB5CCFD9EA583FB020,Aegis / Harborview Banking - Threat Detection Tuning,external,Kevin O'Brien,306.8,"Sure. So within Detect, there are a couple of levers here. The first is what we call trusted location profiles — you can define named network zones or geographic regions that are considered baseline for your organization. So if you tag New York, Chicago, and Manila as your standard operating locations, any authentication from those areas will be weighted differently in the risk scoring engine. It won't suppress the alert entirely, but it drops the severity from high to low or informational depending on the context.",58.65
Security Monitoring & Threat Detection,01KQ41FB5CCFD9EA583FB020,Aegis / Harborview Banking - Threat Detection Tuning,external,Kevin O'Brien,98.1,"Sure, yeah. So the plan for today is — we want to walk through your current Aegis Detect configuration, understand what alert thresholds you have set, talk about any false positive pain points you're running into, and then start mapping out what a tuned detection profile looks like for a financial services environment like yours. We'll also touch on your event source integrations, because that's usually where a lot of the noise comes from in the early onboarding phase.",57.65
Support Troubleshooting & Case Resolution,01KQ56AA6B60801ABC01AB1C,Support Case #8179 - Clearwater Medical Overage Charges Dispute,support,Sarah Chen,442.2,"That's a completely reasonable position. Here's what I can commit to right now — I'm going to flag both of these disputes internally as high priority today. The Comply overage, given the missing alert configuration on migrated accounts, has a very strong basis for a credit or reversal. The Detect overage I need Marcus to verify, but if the billing reflects replay traffic from the outage, that's also something we'd need to reverse. I'd ask that you hold off on payment on the disputed portions while we investigate.",58.95
Support Troubleshooting & Case Resolution,01KQA7DFCE1285F52192B34B,Support Case #9856 - Silverline Brands Backup Window Exceeded,support,David Kim,323.0,"I hear you, and I want to be transparent — so looking at our platform logs, around March 10th through the 18th we had a significant incident with Aegis Detect, our threat monitoring pipeline, and as part of the remediation work we pushed some backend infrastructure updates. Now, Protect and Detect run on separate systems, but some of the underlying network routing configurations were touched as part of that work, and I'm wondering if — and I need to confirm this with our infrastructure team — if some of those changes affected the data transfer paths for backup jobs in your region.",58.4
Support Troubleshooting & Case Resolution,01KQC166F678CBA584AAFF8B,Support Case #7615 - Crestline Wealth Group Policy Sync Delay,support,Sarah Chen,281.9,"Okay so 800 users, and you're on a shared sync cluster tier — I can see that here — and what's happening is the polling cycle is completing but the write queue is backing up because the worker isn't getting enough processing headroom between cycles. It's essentially falling behind itself. Now whether that's purely a configuration issue or whether there's an underlying bug causing the worker to be slower than it should be, I want to be honest, I'm not a hundred percent sure yet.",55.5
